"Author","Time","Score","Thread Level","Is Reply","Comment","Links"
"InfiniteSys","2025-06-29T17:59:05.000Z","172","","No","Looks really promising. I tried it out and it is really fast.

  
A few points that I noticed:  
\- Slider for Whites and Blacks is currently counterintuitive, when I slide to the ritght it gets darker instead of lighter

\- When I push the shadows to the right it does not look brighter just a grey haze over the image

\- For every option you should add a function to reset to default, currently you need to do this manually which is frustrating especially for the curves

\- Masks work fine, just would be great if there could be a warning that the subject (AI) mask is currently not implemented, just like for the AI tab

\- Maybe add a 5:4 aspect ratio as this gets often used for Instagram (at least it was, I am not that active)

  
Really looking forward to the progress of this program",""
"zBlackVision11","2025-06-29T18:03:29.000Z","87","1","Yes","Thanks for your feedback and yes, I’m aware of the Whites/Blacks bug - I had actually forgotten about it over time, but I’ll be fixing it soon.

&gt;

There *is* a reset option already — you can double-click the header/title of the setting to reset it. I realize that’s a bit different from how Lightroom does it, so I’ll try to make that more intuitive or better documented.

I’ll also be adding a warning for unsupported masks soon - or maybe I’ll just go ahead and implement them, haha.

The 5:4 aspect ratio is a great suggestion and will definitely be included in the next release.

Thanks again for your feedback - it’s incredibly helpful and much appreciated!",""
"InfiniteSys","2025-06-29T18:16:07.000Z","24","2","Yes","Okay, found the reset option. Maybe it would be enough to change the mouse cursor when you are hovering above the header / title. Currently it looks just like a text and not something that you would click on.",""
"zBlackVision11","2025-06-29T18:27:57.000Z","18","3","Yes","Great idea, I will try out some options and see what works best. Next release should include this :)",""
"cinderful","2025-06-30T18:53:51.000Z","3","4","Yes","Designer here: simple buttons are always the most usable. A dialog to confirm is also great (if not already included)",""
"zBlackVision11","2025-06-30T18:55:52.000Z","2","5","Yes","Thanks! A simple rotate / reset icon button is there now :) Dialog isn't needed for simple adjustments and for dangerous operations (such as deleting an image or a folder), a dialog exists.",""
"cinderful","2025-06-30T20:02:17.000Z","3","6","Yes","I just tried to run it but saw it's not working/signed on macOS yet :(

Unfortunately, ripping out a build locally on my own is probably not high on my to do list.",""
"zBlackVision11","2025-06-30T20:29:56.000Z","2","7","Yes","You can just paste this terminal command (as shown in the latest release readme) to bypass the signing check, if you're ok with that.",""
"[deleted]","2025-06-30T11:03:15.000Z","10","2","Yes","[removed]",""
"zBlackVision11","2025-06-30T11:08:09.000Z","6","3","Yes","Hahah I already created this small ⟳ next to the title yesterday evening, after this comment. It's already there now :) Thanks tho",""
"[deleted]","2025-06-30T14:04:43.000Z","8","4","Yes","[removed]",""
"zBlackVision11","2025-06-30T14:43:29.000Z","2","5","Yes","Thank you!",""
"zBlackVision11","2025-06-29T20:22:01.000Z","13","1","Yes","Most of what you asked for is implemented now except for the mask warning and the grey haze :)",""
"zBlackVision11","2025-06-30T18:14:54.000Z","6","1","Yes","https://preview.redd.it/khdzw3pmv3af1.png?width=480&amp;format=png&amp;auto=webp&amp;s=5aa0da9f71282893fcb31e06250776dbe2f818f9

AI masks will work soon. I have it correctly implemented locally and I just need to fix some minor bugs and cleanup before I will release it.","https://preview.redd.it/khdzw3pmv3af1.png?width=480&amp;format=png&amp;auto=webp&amp;s=5aa0da9f71282893fcb31e06250776dbe2f818f9"
"InfiniteSys","2025-07-02T14:36:59.000Z","2","2","Yes","Just now had time to test the AI masks and currently I do not think that they are usable. Especially humans seem to never be detected. But also simple things linke a big hat were not detected by the AI mask.  
Still very impressive :)",""
"zBlackVision11","2025-07-03T20:38:32.000Z","2","3","Yes","Hey! Quick update: I found out that the misbehavior with AI masks is related to the RAW format. I created a new release which fixes this. AI masks should work now a lot better for you. Would be cool to get a short feedback if it works now. Release will be up in the next 20mins :)",""
"InfiniteSys","2025-07-04T15:58:16.000Z","2","4","Yes","Works a lot better now :)",""
"zBlackVision11","2025-07-04T16:21:53.000Z","1","5","Yes","Amazing! Thanks a lot for the feedback 👌",""
"zBlackVision11","2025-07-02T14:47:11.000Z","1","3","Yes","You are drawing around them and not clicking on them, right? Thanks for the feedback. Another dude told me they are better than Lightroom’s object mask so I‘m a bit confused now.",""
"zBlackVision11","2025-07-02T15:10:55.000Z","1","3","Yes","Did you use it like this?

https://i.redd.it/ayvcuz7q8haf1.gif","https://i.redd.it/ayvcuz7q8haf1.gif"
"InfiniteSys","2025-07-02T17:57:31.000Z","1","4","Yes","Yeah, thats how I did it, it did work on some pictures but more often than not it was unreliable. See video:  
[https://www.youtube.com/watch?v=PnOe-XOYEKU](https://www.youtube.com/watch?v=PnOe-XOYEKU)","https://www.youtube.com/watch?v=PnOe-XOYEKU"
"zBlackVision11","2025-07-02T20:14:41.000Z","1","5","Yes","Okay I see the problem. I will check it with a similar file soon and hopefully provide a fix somewhat soon.",""
"Donatzsky","2025-06-29T17:02:30.000Z","43","","No","Impressive. You should share it over on https://discuss.pixls.us as well.

On my phone, so haven't had a good look at it yet, but it seems that it only has a dark and a light theme. That's not ideal, since both will negatively affect your perception of saturation, brightness and contrast. The darktable faq has more details: https://www.darktable.org/about/faq/#faq-grey-interface","https://discuss.pixls.us; https://www.darktable.org/about/faq/#faq-grey-interface"
"zBlackVision11","2025-06-29T17:21:43.000Z","40","1","Yes","https://preview.redd.it/pgwkt1u9hw9f1.png?width=1919&amp;format=png&amp;auto=webp&amp;s=602fbba7cea2f2a1216e52692b1771ce73933d56

It's implemented now:  


Thanks again for the suggestion","https://preview.redd.it/pgwkt1u9hw9f1.png?width=1919&amp;format=png&amp;auto=webp&amp;s=602fbba7cea2f2a1216e52692b1771ce73933d56"
"Slasher-McGee","2025-06-29T20:44:33.000Z","6","2","Yes","Is the photo from Glaubenberg in Switzerland?",""
"zBlackVision11","2025-06-29T20:49:23.000Z","11","3","Yes","Yes it is - its a beautiful location, especially in autumn / winter",""
"Slasher-McGee","2025-06-29T20:51:41.000Z","3","4","Yes","Yeah, true! I live 20 minutes from there in another beautiful region :)",""
"zBlackVision11","2025-06-29T20:52:28.000Z","7","5","Yes","Nice hahaha I actually also live about ~45min from there",""
"Slasher-McGee","2025-06-29T20:58:00.000Z","7","6","Yes","Haha geil. Mach wiiter mit dim Programm, isch e geili Sach. Wirds definitiv usprobiere, wenns denn mal uf MacOS lauft :)",""
"zBlackVision11","2025-06-29T21:07:27.000Z","8","7","Yes","Merci :) Ech pinge dich wenns denn endlech uf MacOS lauft 👌  aktuell hani eifach no metem Apple Code Signierigs Zertifikat problem, im grundsatz laufts uf MacOS",""
"zBlackVision11","2025-06-30T09:06:57.000Z","3","7","Yes","Wörd jetzt uf MacOS laufe, muesch eifach vorher no en Terminal befehl usfüehre, um das unsignierte programm z'approve.   
Wird im neuste Release erklärt: [Release RapidRAW v1.0.13](https://github.com/CyberTimon/RapidRAW/releases/tag/v1.0.13)","https://github.com/CyberTimon/RapidRAW/releases/tag/v1.0.13"
"Slasher-McGee","2025-06-30T09:54:02.000Z","2","8","Yes","Cool :) Denn probier ich das mal us die Wuche.
Han der no en Follow uf Insta da glah :) Machsch würkli gueti Arbet!",""
"zBlackVision11","2025-06-29T17:05:15.000Z","8","1","Yes","Thank you very much for your feedback. This is exactly what I'm looking for.  
I plan to share it later on [pixls.us](http://pixls.us) too. 

Regarding the grey theme. That's a very good idea and I will implement it very soon.  
I actually have about 6-8 themes to choose from as of right now, but none of them are really flat / grey what some people might be looking for.","http://pixls.us"
"xmillies","2025-06-29T16:43:23.000Z","58","","No","Very impressive in two weeks.
But do you have try other Opensource software like https://www.rawtherapee.com ?","https://www.rawtherapee.com"
"zBlackVision11","2025-06-29T16:45:23.000Z","75","1","Yes","Yes I tried this and also Darktable. As I wanted to learn a new framework (React / Rust), understand how cameras (especially the raw part) works and create a new project in general I set this as a challenge for myself. Thanks for looking at it :)",""
"H3rBz","2025-06-30T07:02:58.000Z","11","2","Yes","You're doing great! 

I love and use both RawTherapee &amp; Darktable. What I love about yours is the interface is fairly easy to use/self explanatory. Darktable and RT are really powerful but it can suck watching long tutorials or reading wikis - trying to work out fairly simple functions.",""
"TopSlice3396","2025-07-24T17:58:35.000Z","1","3","Yes","I was ready to begin my journey with one of these two programs but they seem overwhelming even though I'd be coming from Lightroom. lol  
How long did it take you to become familiar with these two?",""
"ScrattleGG","2025-06-29T18:26:38.000Z","19","2","Yes","One is a programming language the other a library, which framework are you talking about here?

Nice project kid. Keep at it!",""
"zBlackVision11","2025-06-29T18:29:58.000Z","16","3","Yes","Haha yes you're right. I wanted to say Tauri as the framework but the main part which I planned to learn was the programming language + react library.",""
"SoCalChrisW","2025-06-30T16:54:33.000Z","2","2","Yes","Nice work!

Now that you've done this, do you plan to keep building it and improving it to the point where the OS community starts picking it up?

Or was this a ""This is cool, I learned a lot, hopefully someone forks this and keeps working on it because I'm bored with it now and I'm on to the next project!"" type of project? There's no shame in that, I've done that with many projects. Just curious what you see as the future for this though?",""
"zBlackVision11","2025-06-30T17:14:52.000Z","9","3","Yes","That's a great question. I work on improving it whenever I have the time and motivation, though I can’t make any promises - I've left quite a few projects unfinished in the past. That said, I see a lot of potential in this one, and the positive feedback from the community has been a big motivator to keep going.  
Thanks for your support!",""
"pitviper101","2025-06-30T14:44:53.000Z","1","2","Yes","What are your thoughts on Darktable? I've been contemplating ditching Lightroom for years, but I haven't made the leap.",""
"zBlackVision11","2025-06-30T14:49:32.000Z","4","3","Yes","Darktable is a solid software for sure. But I prefer software which is smooth and has an clean, modern UI which is why I created RapidRAW. I prefer to work with a smooth, clean and simple software, even if it doesn’t‘t produce 100% color accurate results.",""
"Sharlinator","2025-06-30T15:27:16.000Z","2","3","Yes","It's terrible if you're accustomed to Lightroom, honestly. And even if you aren't, it's objectively terrible in many ways.",""
"HugsAllCats","2025-06-29T19:07:53.000Z","22","1","Yes","Oh man, those guys need to pick a new domain/product name

https://static.wikia.nocookie.net/arresteddevelopment/images/e/e3/3x03_Forget-Me-Now_%2812%29.png/revision/latest?cb=20130320220337","https://static.wikia.nocookie.net/arresteddevelopment/images/e/e3/3x03_Forget-Me-Now_%2812%29.png/revision/latest?cb=20130320220337"
"Interstate8","2025-06-29T19:42:39.000Z","18","2","Yes","FOSS devs are the absolute worst at naming products.",""
"cmickledev","2025-06-29T21:05:56.000Z","8","3","Yes","Naming things is hard.",""
"MrHaxx1","2025-06-30T15:44:05.000Z","1","3","Yes","Throwback to when a project was called Crackpipe.


To be fair, it was for downloading cracked game, so it's actually kind of clever... But still. ",""
"foghornjawn","2025-06-29T21:56:26.000Z","5","1","Yes","WTF is that domain name",""
"kenerling","2025-06-29T16:59:55.000Z","82","","No","Kid, take it from an old-timer, I think you're goin' places.


Keep creating and happy shooting to you.",""
"wulfithewulf","2025-06-29T17:59:36.000Z","10","","No","do you have any plans to include negative conversion? last time I did this in darktable it was a pain in the ass, especially with picking the correct base color settings for the film, to get proper colors and such",""
"Donatzsky","2025-06-29T20:41:20.000Z","7","1","Yes","Have a look at Filmvert. It's apparently really good.

[https://github.com/montoyatim01/Filmvert](https://github.com/montoyatim01/Filmvert)","https://github.com/montoyatim01/Filmvert"
"wulfithewulf","2025-06-29T21:27:04.000Z","2","2","Yes","that looks promising, thank you :)",""
"zBlackVision11","2025-06-29T18:27:09.000Z","4","1","Yes","I have now put this on my todo list. I didn't even realize this is a thing as I never used this in Lightroom or other editing softwares :)",""
"curiousjosh","2025-06-29T17:40:28.000Z","9","","No","That’s awesome! Any plans for Mac?",""
"zBlackVision11","2025-06-29T17:42:44.000Z","22","1","Yes","Yes actually- I already provide MacOS builds and tested it a lot on my MacBook Pro. Sadly I don't have a code signing certificate from apple yet so your Mac device will reject it.  
If you still want to try it out you can build it from source using the simple tutorial in the readme ([Getting Started](https://github.com/CyberTimon/RapidRAW?tab=readme-ov-file#getting-started))  
Thanks

EDIT: In the newest release is a short terminal command, which will make the current, precompiled builds work on MacOS.","https://github.com/CyberTimon/RapidRAW?tab=readme-ov-file#getting-started"
"FillMySoupDumpling","2025-06-30T08:57:33.000Z","2","2","Yes","Any plans for iPadOS? How difficult is it to port from macOS to that? ",""
"zBlackVision11","2025-06-30T09:03:59.000Z","2","3","Yes","Should be possible althrough it's not a priority at the moment. I currently have a big focus on core features such as AI stuff etc. Later I can extend it on other platforms such as iPadOS. Tauri, the main framework, supports it already, so it shouldn't be that hard to implement.",""
"FillMySoupDumpling","2025-06-30T14:49:35.000Z","2","4","Yes","Great to hear! Keep up the good work!",""
"swotai","2025-07-01T05:48:30.000Z","2","2","Yes","For some reason when I try to run it it crashed.",""
"zBlackVision11","2025-07-01T06:11:36.000Z","1","3","Yes","Thanks for trying out. What device do you have? / Do older releases (e.g. lower than 1.1.0) work? I will try to run it on my MacBook this evening to see if I also run into issues.",""
"swotai","2025-07-01T21:20:35.000Z","1","4","Yes","I have a Mac mini M4 base.  tried the previous version 1.0.13 works.",""
"zBlackVision11","2025-07-02T07:11:40.000Z","1","5","Yes","Thanks for the clarification. In the meantime the bug is fixed in the newest release.",""
"v270","2025-06-29T18:30:53.000Z","14","","No","Looks like you’re using LibRaw under the hood, so you’re still ultimately tied to dcraw’s demosaic and color science, with no support for compressed CR3, right? Curious if you’re layering anything custom on top of that, or if it’s mainly UI and GPU acceleration over the standard pipeline.",""
"zBlackVision11","2025-06-29T18:36:25.000Z","13","1","Yes","I'm actually using a modified / improved version of the rust rawloader project ([pedrocr/rawloader](https://github.com/pedrocr/rawloader)). It doesn't support CR3 probably, as rawloader itself doesn't support it.   
I will probably, depending on how complex it is, try to support it in the future, as I already was able to implement support for DJI Mavic 3 / 4 Pro's RAW files, which uses a special version of ljepg predictor 6.","https://github.com/pedrocr/rawloader"
"Donatzsky","2025-06-29T20:38:12.000Z","14","2","Yes","Consider using Rawler from DNGLab instead. It's already an improved fork of rawloader.

[https://github.com/dnglab/dnglab](https://github.com/dnglab/dnglab)","https://github.com/dnglab/dnglab"
"zBlackVision11","2025-06-29T20:39:12.000Z","8","3","Yes","Amazing - thanks for sharing. I will look into it in the coming days!",""
"Donatzsky","2025-06-29T20:58:29.000Z","10","4","Yes","By contributing to Rawler you also help other projects, such as vkdt, that uses it. I'm not sure having yet another raw loader library used by a single project serves anyone.",""
"fruchle","2025-07-03T05:04:46.000Z","1","2","Yes","While pedrocr/rawloader says it supports Sony ARW - it doesn't for me (v1.1.1)",""
"zBlackVision11","2025-07-03T05:06:11.000Z","1","3","Yes","What exact camera do you have? I have a A7iii and its RAW images work perfectly. Its probably best to wait 1-2 days until I implemented the new rawloader. Thanks :)",""
"fruchle","2025-07-03T09:21:01.000Z","1","4","Yes","A7RIV, and sure thing.",""
"zBlackVision11","2025-07-03T09:46:58.000Z","2","5","Yes","Makes sense - this camera uses a new ARW version which this outdated loader doesnt support. Will be fixed in further releases.",""
"danielsuperone","2025-10-10T15:53:10.000Z","1","2","Yes","does it support cr3 please?",""
"zBlackVision11","2025-10-10T15:57:36.000Z","1","3","Yes","Yes it works now 😃",""
"SnoopySenpai","2025-06-29T17:47:08.000Z","8","","No","Seems really cool! I'll check it out and compare it to DxO PhotoLab soon.

Feature request: I usually come home with thousands of files as I shoot in burst mode all the time (wildlife photography). At home I need to go through all of them and rate them. I'd love a special mode where one can rate (1-5), zoom in and quickly hop back and forth between photos. Not anything else to keep it super fast, but every function should have a simple keybind (i.e rating with number keys 1-5, hopping back and forth with arrow keys, and keybinds for ""fit to frame"", ""100%"" and ""200%"", while zoomed the photo could be moved with the mouse).",""
"zBlackVision11","2025-06-29T17:54:50.000Z","10","1","Yes","Thank you for your feedback. Keybinds for rating (1-5) and keybinds for hopping between images (arrow keys) actually already exist. I will soon add some shortcuts for zooming too.",""
"SnoopySenpai","2025-06-29T18:06:01.000Z","2","2","Yes","Awesome.
Looking forward to trying it.",""
"Commercial_Sun_6300","2025-06-29T18:31:43.000Z","6","","No","Could you tell me more about how which language you learned first, how you learned it, etc? I hadn't heard of WGSL and looked it up, apparently the syntax is similar to Rust. Had you used WGSL before starting this project?

Before learning to use React, did you learn the basics of HTML/CSS/Javascript by themselves or did you learn it in the context of React? 

I'd love to learn about programming too and I think you did something really smart and creative and found a good goal which motivated you. I hope you have some time to share more about your learning process. (Not just the two weeks, but earlier stuff too.)",""
"zBlackVision11","2025-06-29T20:29:29.000Z","2","1","Yes","Thanks for the nice feedback! I started learning HTML, CSS, and JavaScript about three years ago. After that, I got into making games with Unity and Unreal Engine. Even though Unreal uses a node-based system, it still helped me understand a lot about how programming works.

When ChatGPT came out, I got really interested in Python and machine learning / training of language models. Since then, I’ve been learning other languages like Rust and JavaScript libraries like React. I enjoy building small projects with language models, and I really like making simple remakes of other programms or implement already existing stuff on my own, with help of language models.",""
"cialu","2025-06-29T19:26:01.000Z","6","","No","Impressive. Waiting for the Linux port… ;-)",""
"zBlackVision11","2025-06-29T19:31:17.000Z","3","1","Yes","Thank you! Will be there soon. It shouldn't be hard to implement.",""
"pragmatick","2025-06-29T17:49:07.000Z","11","","No","An impressive feat and great demo what can nowadays be achieved with AI.",""
"zBlackVision11","2025-06-29T17:57:57.000Z","3","1","Yes","Thank you!",""
"NotJebediahKerman","2025-06-29T18:00:34.000Z","5","","No","so... before I download, does it work with ALL raw files or just the major players like Sony, Canon, Olympus, and Nikon?  I ask because I shoot MF digital and it's *different*.  It drove me to RawTherapee as I also am moving to Linux for daily work.  Can provide leaf and Phase one IQ files if you'd like to push it more.  DM me.",""
"zBlackVision11","2025-06-29T18:06:42.000Z","3","1","Yes","I use a modified / improved version of [pedrocr/rawloader](https://github.com/pedrocr/rawloader) to load / read the raw files from different manufacturers and it looks like it doesn't support it (yet - althrough the project looks stalled). Would be cool if you could send me some demo files - then I can try to implement it when I have time.  
Thanks!","https://github.com/pedrocr/rawloader"
"Taidashar","2025-06-29T18:57:58.000Z","3","2","Yes","It looks like it doesn't support Canon CR3 files yet? Or am I missing something?",""
"zBlackVision11","2025-06-29T19:28:54.000Z","6","3","Yes","You see this correct. It doesn't support Canon CR3 files yet. I just found this issue on the rawloader github: [CR3 support · Issue #23 · pedrocr/rawloader](https://github.com/pedrocr/rawloader/issues/23)

I might take a look how it's implemented in dnglab and try to port this over to my RapidRAW rawloader.","https://github.com/pedrocr/rawloader/issues/23"
"Taidashar","2025-06-29T19:54:39.000Z","4","4","Yes","Damn, that's a shame. That project definitely seems stalled then, since CR3 has been around since 2018 lol.

Would be pretty sweet if you could get it working. I downloaded RapidRAW and it looks great (dug up some old cr2 files to give it a test) but without CR3 support it's useless for me (and basically everyone else using a Canon mirrorless camera)

Great work on this project though, very impressive especially considering the timeframe!",""
"zBlackVision11","2025-06-29T20:25:12.000Z","3","5","Yes","Yes I try to implement it in the coming days. I will respond here when it's working. Stay tuned :)",""
"Lozula","2025-07-02T22:59:16.000Z","1","6","Yes","ah thanks, wondered why my cr3 files weren't working",""
"kendrid","2025-06-29T21:52:47.000Z","3","5","Yes","The project is so old it doesn't support Nikon Z cameras.",""
"zBlackVision11","2025-07-05T07:44:02.000Z","2","5","Yes","CR3 support is there now :)",""
"Taidashar","2025-07-10T10:29:03.000Z","2","6","Yes","Awesome! I will give it a try",""
"kendrid","2025-06-29T21:52:54.000Z","4","4","Yes","FYI the project is so old it doesn't support Nikon Z cameras.",""
"NotJebediahKerman","2025-06-29T18:33:32.000Z","2","2","Yes","I stumbled on this a month or two ago, looked interesting but more for the newer backs.  Their SDK for talking to the camera but it also has their image SDK as well [Phase one image/camera sdk](https://developer.phaseone.com/sdk/docs/classes.html).  

I have plenty of pics I can share, just need to figure out how/where, these things are 60+ MB per raw file.","https://developer.phaseone.com/sdk/docs/classes.html"
"Donatzsky","2025-06-29T20:54:19.000Z","2","3","Yes","[raw.pixls.us](http://raw.pixls.us) is the place to submit samples if you want to help open-source software.","http://raw.pixls.us"
"NotJebediahKerman","2025-06-30T03:32:45.000Z","1","4","Yes","uploaded - too many wires in the area for my liking and I didn't move to fix that.",""
"Donatzsky","2025-06-29T20:49:53.000Z","2","2","Yes","There are probably already samples on [raw.pixls.us](http://raw.pixls.us) and if not, it would be great if u/NotJebediahKerman could change that.","http://raw.pixls.us"
"nobullvegan","2025-06-29T18:43:19.000Z","5","","No","You really ought to make your rawloader fork into its own repo so you preserve the proper history and attribution. You could include it as a git submodule instead.

Looks neat, though!",""
"zBlackVision11","2025-06-29T19:30:34.000Z","2","1","Yes","You're right. I initially just merged it into my project as I thought I would have to heavily rewrite it to make it more compatible (e.g. Mavic 3/4 Pro's DNG etc). I will definitely add proper attribution soon or use it as a submodule.  
EDIT: Added proper attribution until I implement a better solution (e.g. submodule)",""
"Yaroslav770","2025-06-29T19:39:38.000Z","4","","No","If you're going for GPU acceleration it'd be also really handy to have support for a shading language.

I switched to vkdt a few months ago and being able to write my own shaders has been tremendous, can't stress how much better a node based, HDR workflow has been.",""
"lucasnviana","2025-07-05T06:36:07.000Z","1","1","Yes","How about Mac support?",""
"Yaroslav770","2025-07-05T08:03:18.000Z","1","2","Yes","I'm not the vkdt dev and I don't use a Mac so I can't help you there.",""
