"Author","Time","Score","Thread Level","Is Reply","Comment","Links"
"repomonkey","2025-06-30T00:50:26.000Z","5","","No","Great work here - very impressive for two weeks. I'm on a Mac and had GPT lead me through compiling it and building the app package and was up and running in a couple of minutes.

Couple of observations:  
1) need to be able to disable the overlay on the mask to see what's happening on the local edits.  
2) look at the fall-off on the sliders - the highlights for instance is pretty brutal - very all or nothing.  
3) contrast is strongly affecting brightness  
4) vibrance seems to skew heavily towards magenta - not sure why  
5) would be great to get some chromatic aberration control

Anyway - it's a really promising start and I genuinely hope you stick with it and continue to refine and build-out the app. I hope you stick to the Lightroom-like template and avoid the Darktable approach. I think you'll find that there's a massive potential audience for the app if you keep it this user-friendly.",""
"zBlackVision11","2025-06-30T13:44:05.000Z","2","1","Yes","Thank you for your feedback. That's really helpful. I try to improve it this evening in some of the areas you've described.",""
"AirSKiller","2025-06-29T17:29:59.000Z","8","","No","That’s insane? You got any socials I can follow? You’re going places and I want to follow your journey.",""
"zBlackVision11","2025-06-29T17:40:02.000Z","7","1","Yes","Thanks a lot. You can follow me on instagram, where I post pictures from my photography trips quite often: [@timonkaech.photography](https://www.instagram.com/timonkaech.photography/)","https://www.instagram.com/timonkaech.photography/"
"AirSKiller","2025-06-29T17:46:54.000Z","2","2","Yes","Just did.

Amazing shots too!",""
"Excentriekegast","2025-07-01T01:46:36.000Z","2","2","Yes","I'll follow you now. 
I didn't download your program yet, I'll when it's one click to install on MacOs, but if it doesn't have tethering function, would you implement it?

P.s. my compliments for all the work.",""
"zBlackVision11","2025-07-01T04:37:07.000Z","2","3","Yes","Thanks! What kind of tethering function are you looking for?",""
"UmbwaKaali","2025-07-09T17:43:17.000Z","2","2","Yes","Did so too.. your photos are amazing ",""
"rpungello","2025-06-29T20:41:26.000Z","5","","No","&gt; File size is under 30MB, and it runs on Windows &amp; macOS.

Cross-platform editor that's smaller than a single raw file from many cameras out there.",""
"sacules","2025-06-30T15:00:52.000Z","4","","No","Heh I was also building a similar gpu-accelerated project some time ago but seems you beat me by quite a margin lol. I think I'll just try to contribute to yours :)",""
"zBlackVision11","2025-06-30T15:02:22.000Z","3","1","Yes","Thanks for your feedback. I‘m sure your project was also good. I also wouldn‘t have achieved this speed without the help of language models / ai. I appreciate if you want to contribute too :)",""
"sacules","2025-06-30T15:07:27.000Z","3","2","Yes","Definitely! If you're also open to some UX/UI and react suggestions, I can open up an issue or two.

Quick question, does it support other file formats like TIFF, BMP, and JPEG? I shoot film and my scans are in such formats. I'd also love to take a crack at a film inversion feature, as that was my goal originally heh.",""
"zBlackVision11","2025-06-30T15:56:48.000Z","2","3","Yes","Yes, if you have any suggestions etc, feel free to open a github issue.  
Another person already asked for the film inversion feature so I will probably code this pretty soon. It supports JPEG and BMP but not TIFF yet.  
  
Thanks!",""
"MrHaxx1","2025-06-30T16:29:57.000Z","5","","No","I just give it a try, and it seems super cool! It's honestly not super far from being able to replace Lightroom for me.

Here's some feedback:

* Please enable scroll wheel for sliders

* I tried to crop an image, but for some reason, I couldn't zoom out far enough to actually grab the corner. Even if I zoomed out in another view, the crop view just zoomed in, for some reason. Image is 6020x4024

* 1:1 crop is clearly not 1:1

* Flip doesn't do anything

* How do I use the AI mask?? I select it, but I can't actually mask anything

* I tried to brush mask, but the effects applied to somewhere else on the image, on not where I had actually chosen it

* please add shift/ctrl+scroll for quick brush size adjustment

* There should probably a settings panel somewhere, at least for keyboard shortcuts and such

* Lastly, add the app to Winget, so we can install it with ""Winget install CyberTimon.RapidRAW"". This also enables easier updates for Windows users.

Anyway, this is still amazing for two weeks of work. Great job! I'll definitely be keeping an eye on it.",""
"zBlackVision11","2025-06-30T16:35:12.000Z","2","1","Yes","Thank you a lot for testing it out and for your feedback. 

* How do you think is the best way to implement scroll wheel functionality for the sliders? Because the scroll is already used to scroll down the adjustments / controls panel.
* Regarding the crop issue, I actually also had this problem and I'm working on a solution now, althrough I couldn't fix it for like the last 1-2 hours. 
* 1:1 crop should be 1:1, I will test with your image size soon to see if I can reproduce it. 
* AI masks aren't there yet and I will add a proper work in progress visualization soon.
* Brush masks are a bit buggy as of right now, they definitely need more polishing. 
* Regarding the settings panel, there is one, but you can't change the keyboard settings there right now. 
* Yes I plan to add the app to more sources, like Winget, but I have to focus on the main priorities first.

Thank you again for the feedback!",""
"MrHaxx1","2025-06-30T16:52:33.000Z","1","2","Yes","&gt;How do you think is the best way to implement scroll wheel functionality for the sliders? Because the scroll is already used to scroll down the adjustments / controls panel.

That's a good point. I see two options: Either put it in a very specific location (like the textbox), so there's low risk of it disabling scrolling, or have it be enabled by alt/shift/ctrl.

&gt;1:1 crop should be 1:1, I will test with your image size soon to see if I can reproduce it.

Thanks. I don't know if it's maybe related to the same zoom bug?

&gt;settings

Oh, yeah, I found it now. I don't think it's particularly intuitive to have to go all the way ""out"" of the application to access it, tbh. I'd be fine with having it in a corner somewhere. But I suppose that there aren't enough settings at the moment, to justify having it elsewhere.

More feature requests:

* Copypasting edits between photos would be nice

* Hiding categories of adjustments (the eye icon in Lightroom) for easier comparison

On another note, I just restarted RapidRAW and it stopped finding images in any of the folders.",""
"zBlackVision11","2025-06-30T17:17:25.000Z","1","3","Yes","* Copypasting edits between photos would be nice

hahaha I literally added it everywhere possible. You can right click on the image, press copy Adjustments, you can copy the adjustments in the bottom bar, you can copy the adjustments using CTRL C and then paste it the same way like before (Right click, bottom bar, CTRL V). You can even batch paste it when you have multiple images selected, using CTRL or SHIFT

* Hiding categories of adjustments (the eye icon in Lightroom) for easier comparison

That's a good idea. I will implement this in the near future. 

Thank you!",""
"MrHaxx1","2025-06-30T17:29:54.000Z","1","4","Yes","Dang, my bad. I just kind of assumed it wasn't there. I couldn't check it, because it broke for me lol",""
"zBlackVision11","2025-06-30T17:47:01.000Z","1","5","Yes","No problem. Can you please tell me more about how it broke for you? Does it still not work when you change folder or delete the thumbnail cache in the settings? What PC do you have (SSD or HDD)? Thanks again",""
"MrHaxx1","2025-07-01T19:16:44.000Z","2","6","Yes","Uh, you know, it turns out that it was actually pictures in some folders that were missing. Nothing wrong with your program. My bad again.",""
"zBlackVision11","2025-07-01T19:26:01.000Z","1","7","Yes","All okay - thanks for the clarification!",""
"royeiror","2025-06-30T17:17:06.000Z","1","2","Yes","I haven't yet tested, I've been reading the whole thread, but the way the scrolling could work, it to have different behaviors depending on what the mouse pointer is hovering over.   
For example if its hovering over the slider, then the scrolling affects the slider and not the vertical scrolling of the list of adjustments.   

My guess is that to make it obvious, there would be a change of color or padding around the affected slider. Also maybe when you hover over the slider, the scrolling is activated after a second or two, keeping the vertical scrolling intuitive.   

Another thing is that maybe middle clicking the slider could reset it to default.",""
"zBlackVision11","2025-06-30T17:20:40.000Z","2","3","Yes","Thanks for your feedback. I will consider this in future releases.",""
"Affectionate_Spell11","2025-07-07T02:13:33.000Z","3","","No","I just finished editing my latest shoot with this and first off, I really, really like what you've done here. I'm seriously ready to switch as I never really fell in love with darktable, that just feels really unwieldy and unintuitive at times. That said, I've noticed some things I'd like to see in future versions. Some of this will be bugs, others feature requests, but I feel like most of these should be fairly uncomplicated to implement, so in no particular order:

-the Metadata panel could use some reordering, right now there's a lot of stuff I don't really care about before stuff I do(lens/exposure info, shooting mode etc.) Also, I'd love to have focal length, iso, aperture and shutter speed visible even outside that panel, maybe in the same line as the file name  
-Space to zoom is acting a bit weird for me, I'd prefer if it centered on the cursor instead of the top left corner. There's also a bug where after dragging the view around hitting space again doesn't zoom out, but returns to the top left at 200% and then doesn't do anything until I change photos(it might also be worth a thought to make space return to 100% if the zoom level is anything else)  
-I often need to decide between two pictures, and currently there's just a bit too long of a delay when flipping between them, is it possible to keep the last few photos in cache in full resolution/do some sort of side by side feature?  
-I'd love to be able to filter by rating, e.g. show just 4 star images or don't show anything below 3 stars  
-I really missed being able to toggle clipping indicators  
-One thing I really like about darktable is that a double click will reset a slider, it's really helpful for A-B-ing just that one adjustment   
-A couple times copying adjustments deleted the star rating on the copied to image. I haven't been able to reproduce this consistently, but it only affected copying to a single image, never to a batch  
-the default crop ratio should be original or user selectable imo. 90% of cases I just want to punch in a bit, but keep the aspect ratio, and it's slightly annoying to have to click original every time  
-when cropping portrait orientation shots, I can't zoom out far enough to drag the edges in, essentially making cropping impossible. Related to that, I'd prefer it if opening the crop panel didn't automatically zoom in  
-Have you thought about having the rotate function automatically crop in to eliminate ""blank"" corners?  
-I'd prefer the WB and exposure sliders to be in Kelvin/stops respectively instead of 0-100  
-The vignette slider feels backwards to me, intuitively I'd expect dragging it right to darken the corners instead of lightening them  
-I'd love to have a B/W conversion tool. Doesn't have to be fancy, just a thing that turns the photo B/W with control over individual RGB channels would be enough for me  
-when exporting, the counter doesn't update for me 

Hope this was at least somewhat understandable, if not, feel free to ask! I know it's quite a bit, but that's what I noticed when using it, so I figured I'd flag it :) Again, really impressed with what you've accomplished already, and I'm very eager to see what else you'll do with this!",""
"zBlackVision11","2025-07-07T19:58:31.000Z","2","1","Yes","Wow - thank you very much for this detailed feedback and I'm very happy that you enjoyed using RapidRAW.

I will open a github issue with a link to this reddit post to better track your feedback. Do you have a github account / username, so I can add you to the issue?

Reference issue, which I just created: [Usability Improvements, Bugs, and Feature Requests from Reddit · Issue #26 · CyberTimon/RapidRAW](https://github.com/CyberTimon/RapidRAW/issues/26)

Thanks a lot!","https://github.com/CyberTimon/RapidRAW/issues/26"
"Affectionate_Spell11","2025-07-07T22:07:25.000Z","2","2","Yes","My pleasure!    
I'm gratinator on GitHub",""
"zBlackVision11","2025-07-08T20:15:06.000Z","1","3","Yes","I implemented most of your wished features - checkout the github issue if you haven‘t done it already :)",""
"Affectionate_Spell11","2025-07-08T20:51:42.000Z","2","4","Yes","Yep, saw a couple of updates the last few days \^\^  
Awesome work, looking forward to trying it out (and wouldn't you know it, I'll most likely have some new shots after the weekend)",""
"zBlackVision11","2025-07-09T10:21:44.000Z","1","5","Yes","Enjoy shooting 📸",""
"BusinessNo4491","2025-06-29T20:46:25.000Z","3","","No","Just built on my Mac (suprisingly simple for a rookie) and it works great! It is indeed very fast. Something interesting happening when I try to crop, though, where it doesn't really crop but just kinda frames the image inside itself.. not really sure how to describe it more clearly. Perhaps there's something I'm missing?",""
"BusinessNo4491","2025-06-29T20:55:22.000Z","2","1","Yes","Just check and seems to work properly when exported though :)",""
"BusinessNo4491","2025-06-29T20:55:47.000Z","1","2","Yes","SO much better than darktable.. thanks so much",""
"zBlackVision11","2025-06-30T06:40:07.000Z","2","1","Yes","Thank you for your answer and for trying it out. Can you please try to explain the crop issue better so I can try to fix / improve it?",""
"[deleted]","2025-06-30T05:37:27.000Z","3","","No","if you want insight into building something for culling photos, man please reach out to me and I will help us build something better than what lightroom currently offers and genuinely think if we get it right it would be a money making machine, cause I am TIRED of culling through thousands of photos after each gig just to send 50 photos

been doing this for 10 years and have been thinking about ways to optimize it for years, and everything I find online to speed up the workflow is not better than my current technique, so I’m confident I’m on to something",""
"yes_that_redditor","2025-07-09T10:09:49.000Z","1","1","Yes","An 18-year old built a full RAW editing app in two weeks using AI. I'm sure you could come up with a demo or prototype. If it's good, people will throw money at you and you'll be able to improve it.",""
"Ezelryb","2025-06-30T18:06:42.000Z","3","","No","Upvote for rust 🦀",""
"Nexis4Jersey","2025-07-01T12:54:31.000Z","3","","No","This is a great app and Idea.    There is a need for a more simplified yet powerful Lightroom clone with good ui...as much as I love Darktable it has a steep learning curve that can be hard for new users.    Will you add a Digital Asset Manager to the app like Lightroom has , so far most apps can't match that part of Lightroom.",""
"zBlackVision11","2025-07-01T13:07:05.000Z","2","1","Yes","Thanks a lot for your feedback. What feature do you like the most from Lightrooms Image Library / Asset Manager?",""
"Nexis4Jersey","2025-07-01T13:09:10.000Z","1","2","Yes","I like being able to see how many shots i've taken sorted by Date , lens type , focal length , iso...etc",""
"zBlackVision11","2025-07-01T14:08:44.000Z","1","3","Yes","Thats actually a great idea. Added on my todo list ☑️",""
"Nexis4Jersey","2025-07-01T14:23:46.000Z","1","4","Yes","Have you thought about using Darktables code for the raw?   When testing I found your app doesn't handle HDR very well.",""
"zBlackVision11","2025-07-01T14:50:55.000Z","1","5","Yes","Directly using darktables code isnt something I plan to do. Regarding the HDR images, I havent tested HDR images yet so its normal that they arent working well. I try to improve it over the coming weeks.",""
"xAtlas5","2025-06-29T17:53:46.000Z","6","","No","&gt; I am immensely grateful for Google's Gemini suite of AI models.

So uh. Did you just copy + paste code from Gemini or...?",""
"zBlackVision11","2025-06-29T17:57:30.000Z","12","1","Yes","Yes, I definitely relied on AI assistance, especially for parts of the code that involved complex or unclear concepts, as well as for handling repetitive tasks. That said, anyone with coding experience knows there's much more involved than simply copying and pasting code.",""
"JaguarImpossible2427","2025-06-29T17:04:24.000Z","2","","No","awesome, gonna try it out 🤩",""
"zBlackVision11","2025-06-29T17:05:31.000Z","1","1","Yes","Nice! Thanks :)",""
"Sinaaaa","2025-06-29T19:17:48.000Z","2","","No","This looks unbelievable for 2 weeks. 

Does it have a texture slider hidden somewhere?",""